0.000000 0.000000 IP 192.168.10.201.49816 > 192.168.10.200.1234: Flags [S], seq 1555664477, win 29200, options [mss 1460,nop,nop,sackOK,nop,wscale 7], length 0
0.000173 0.000173 IP 192.168.10.200.1234 > 192.168.10.201.49816: Flags [S.], seq 3117088680, ack 1555664478, win 64240, options [mss 1460,nop,nop,sackOK,nop,wscale 7], length 0
0.000202 0.000029 IP 192.168.10.201.49816 > 192.168.10.200.1234: Flags [.], ack 1, win 229, length 0
0.000258 0.000056 IP 192.168.10.201.49816 > 192.168.10.200.1234: Flags [P.], seq 1:2, ack 1, win 229, length 1
0.000320 0.000062 IP 192.168.10.200.1234 > 192.168.10.201.49816: Flags [.], ack 2, win 502, length 0
0.000622 0.000302 IP 192.168.10.200.1234 > 192.168.10.201.49816: Flags [P.], seq 1:2, ack 2, win 502, length 1
0.000628 0.000006 IP 192.168.10.201.49816 > 192.168.10.200.1234: Flags [.], ack 2, win 229, length 0
0.500834 0.500206 IP 192.168.10.201.49816 > 192.168.10.200.1234: Flags [P.], seq 2:3, ack 2, win 229, length 1
0.500972 0.000138 IP 192.168.10.200.1234 > 192.168.10.201.49816: Flags [P.], seq 2:3, ack 3, win 502, length 1
0.500994 0.000022 IP 192.168.10.201.49816 > 192.168.10.200.1234: Flags [.], ack 3, win 229, length 0
1.001188 0.500194 IP 192.168.10.201.49816 > 192.168.10.200.1234: Flags [P.], seq 3:4, ack 3, win 229, length 1
1.001321 0.000133 IP 192.168.10.200.1234 > 192.168.10.201.49816: Flags [P.], seq 3:4, ack 4, win 502, length 1
1.001342 0.000021 IP 192.168.10.201.49816 > 192.168.10.200.1234: Flags [.], ack 4, win 229, length 0
1.501470 0.500128 IP 192.168.10.201.49816 > 192.168.10.200.1234: Flags [P.], seq 4:5, ack 4, win 229, length 1
1.501617 0.000147 IP 192.168.10.200.1234 > 192.168.10.201.49816: Flags [P.], seq 4:5, ack 5, win 502, length 1
1.501636 0.000019 IP 192.168.10.201.49816 > 192.168.10.200.1234: Flags [.], ack 5, win 229, length 0
2.001857 0.500221 IP 192.168.10.201.49816 > 192.168.10.200.1234: Flags [P.], seq 5:6, ack 5, win 229, length 1
2.002013 0.000156 IP 192.168.10.200.1234 > 192.168.10.201.49816: Flags [P.], seq 5:6, ack 6, win 502, length 1
2.002035 0.000022 IP 192.168.10.201.49816 > 192.168.10.200.1234: Flags [.], ack 6, win 229, length 0
2.502236 0.500201 IP 192.168.10.201.49816 > 192.168.10.200.1234: Flags [P.], seq 6:7, ack 6, win 229, length 1
2.502368 0.000132 IP 192.168.10.200.1234 > 192.168.10.201.49816: Flags [P.], seq 6:7, ack 7, win 502, length 1
2.502394 0.000026 IP 192.168.10.201.49816 > 192.168.10.200.1234: Flags [.], ack 7, win 229, length 0
3.002592 0.500198 IP 192.168.10.201.49816 > 192.168.10.200.1234: Flags [P.], seq 7:8, ack 7, win 229, length 1
3.002757 0.000165 IP 192.168.10.200.1234 > 192.168.10.201.49816: Flags [P.], seq 7:8, ack 8, win 502, length 1
3.002780 0.000023 IP 192.168.10.201.49816 > 192.168.10.200.1234: Flags [.], ack 8, win 229, length 0
3.502983 0.500203 IP 192.168.10.201.49816 > 192.168.10.200.1234: Flags [P.], seq 8:9, ack 8, win 229, length 1
3.503156 0.000173 IP 192.168.10.200.1234 > 192.168.10.201.49816: Flags [P.], seq 8:9, ack 9, win 502, length 1
3.503178 0.000022 IP 192.168.10.201.49816 > 192.168.10.200.1234: Flags [.], ack 9, win 229, length 0
4.003391 0.500213 IP 192.168.10.201.49816 > 192.168.10.200.1234: Flags [P.], seq 9:10, ack 9, win 229, length 1
4.003509 0.000118 IP 192.168.10.200.1234 > 192.168.10.201.49816: Flags [P.], seq 9:10, ack 10, win 502, length 1
4.003527 0.000018 IP 192.168.10.201.49816 > 192.168.10.200.1234: Flags [.], ack 10, win 229, length 0
4.503716 0.500189 IP 192.168.10.201.49816 > 192.168.10.200.1234: Flags [P.], seq 10:11, ack 10, win 229, length 1
4.503803 0.000087 IP 192.168.10.200.1234 > 192.168.10.201.49816: Flags [P.], seq 10:11, ack 11, win 502, length 1
4.503839 0.000036 IP 192.168.10.201.49816 > 192.168.10.200.1234: Flags [.], ack 11, win 229, length 0
5.004023 0.500184 IP 192.168.10.201.49816 > 192.168.10.200.1234: Flags [F.], seq 11, ack 11, win 229, length 0
5.004251 0.000228 IP 192.168.10.200.1234 > 192.168.10.201.49816: Flags [F.], seq 11, ack 12, win 502, length 0
5.004279 0.000028 IP 192.168.10.201.49816 > 192.168.10.200.1234: Flags [.], ack 12, win 229, length 0
