0.000000 0.000000 IP 192.168.10.201.51786 > 192.168.10.200.1234: Flags [S], seq 4039066892, win 29200, options [mss 1460,nop,nop,sackOK,nop,wscale 7], length 0
0.000179 0.000179 IP 192.168.10.200.1234 > 192.168.10.201.51786: Flags [S.], seq 813782965, ack 4039066893, win 64240, options [mss 1460,nop,nop,sackOK,nop,wscale 7], length 0
0.000206 0.000027 IP 192.168.10.201.51786 > 192.168.10.200.1234: Flags [.], ack 1, win 229, length 0
0.000281 0.000075 IP 192.168.10.201.51786 > 192.168.10.200.1234: Flags [P.], seq 1:2, ack 1, win 229, length 1
0.000375 0.000094 IP 192.168.10.200.1234 > 192.168.10.201.51786: Flags [.], ack 2, win 502, length 0
0.000576 0.000201 IP 192.168.10.200.1234 > 192.168.10.201.51786: Flags [P.], seq 1:2, ack 2, win 502, length 1
0.042182 0.041606 IP 192.168.10.201.51786 > 192.168.10.200.1234: Flags [.], ack 2, win 229, length 0
0.500787 0.458605 IP 192.168.10.201.51786 > 192.168.10.200.1234: Flags [P.], seq 2:3, ack 2, win 229, length 1
0.500927 0.000140 IP 192.168.10.200.1234 > 192.168.10.201.51786: Flags [P.], seq 2:3, ack 3, win 502, length 1
0.542176 0.041249 IP 192.168.10.201.51786 > 192.168.10.200.1234: Flags [.], ack 3, win 229, length 0
1.001157 0.458981 IP 192.168.10.201.51786 > 192.168.10.200.1234: Flags [P.], seq 3:4, ack 3, win 229, length 1
1.001325 0.000168 IP 192.168.10.200.1234 > 192.168.10.201.51786: Flags [P.], seq 3:4, ack 4, win 502, length 1
1.043186 0.041861 IP 192.168.10.201.51786 > 192.168.10.200.1234: Flags [.], ack 4, win 229, length 0
1.501553 0.458367 IP 192.168.10.201.51786 > 192.168.10.200.1234: Flags [P.], seq 4:5, ack 4, win 229, length 1
1.501678 0.000125 IP 192.168.10.200.1234 > 192.168.10.201.51786: Flags [P.], seq 4:5, ack 5, win 502, length 1
1.542184 0.040506 IP 192.168.10.201.51786 > 192.168.10.200.1234: Flags [.], ack 5, win 229, length 0
2.001885 0.459701 IP 192.168.10.201.51786 > 192.168.10.200.1234: Flags [P.], seq 5:6, ack 5, win 229, length 1
2.001971 0.000086 IP 192.168.10.200.1234 > 192.168.10.201.51786: Flags [P.], seq 5:6, ack 6, win 502, length 1
2.042188 0.040217 IP 192.168.10.201.51786 > 192.168.10.200.1234: Flags [.], ack 6, win 229, length 0
2.502210 0.460022 IP 192.168.10.201.51786 > 192.168.10.200.1234: Flags [P.], seq 6:7, ack 6, win 229, length 1
2.502322 0.000112 IP 192.168.10.200.1234 > 192.168.10.201.51786: Flags [P.], seq 6:7, ack 7, win 502, length 1
2.543185 0.040863 IP 192.168.10.201.51786 > 192.168.10.200.1234: Flags [.], ack 7, win 229, length 0
3.002535 0.459350 IP 192.168.10.201.51786 > 192.168.10.200.1234: Flags [P.], seq 7:8, ack 7, win 229, length 1
3.002662 0.000127 IP 192.168.10.200.1234 > 192.168.10.201.51786: Flags [P.], seq 7:8, ack 8, win 502, length 1
3.043179 0.040517 IP 192.168.10.201.51786 > 192.168.10.200.1234: Flags [.], ack 8, win 229, length 0
3.502875 0.459696 IP 192.168.10.201.51786 > 192.168.10.200.1234: Flags [P.], seq 8:9, ack 8, win 229, length 1
3.503014 0.000139 IP 192.168.10.200.1234 > 192.168.10.201.51786: Flags [P.], seq 8:9, ack 9, win 502, length 1
3.543174 0.040160 IP 192.168.10.201.51786 > 192.168.10.200.1234: Flags [.], ack 9, win 229, length 0
4.003230 0.460056 IP 192.168.10.201.51786 > 192.168.10.200.1234: Flags [P.], seq 9:10, ack 9, win 229, length 1
4.003356 0.000126 IP 192.168.10.200.1234 > 192.168.10.201.51786: Flags [P.], seq 9:10, ack 10, win 502, length 1
4.045176 0.041820 IP 192.168.10.201.51786 > 192.168.10.200.1234: Flags [.], ack 10, win 229, length 0
4.503599 0.458423 IP 192.168.10.201.51786 > 192.168.10.200.1234: Flags [P.], seq 10:11, ack 10, win 229, length 1
4.503702 0.000103 IP 192.168.10.200.1234 > 192.168.10.201.51786: Flags [P.], seq 10:11, ack 11, win 502, length 1
4.544182 0.040480 IP 192.168.10.201.51786 > 192.168.10.200.1234: Flags [.], ack 11, win 229, length 0
5.003923 0.459741 IP 192.168.10.201.51786 > 192.168.10.200.1234: Flags [F.], seq 11, ack 11, win 229, length 0
5.004102 0.000179 IP 192.168.10.200.1234 > 192.168.10.201.51786: Flags [F.], seq 11, ack 12, win 502, length 0
5.004130 0.000028 IP 192.168.10.201.51786 > 192.168.10.200.1234: Flags [.], ack 12, win 229, length 0
