0.000000 0.000000 IP 192.168.10.204.51934 > 192.168.10.201.1234: Flags [S], seq 2600241090, win 65535, options [mss 1460,nop,wscale 6,sackOK,TS val 3054278889 ecr 0], length 0
0.000161 0.000161 IP 192.168.10.201.1234 > 192.168.10.204.51934: Flags [S.], seq 3320573224, ack 2600241091, win 29200, options [mss 1460,nop,nop,sackOK,nop,wscale 7], length 0
0.000191 0.000030 IP 192.168.10.204.51934 > 192.168.10.201.1234: Flags [.], ack 1, win 1027, length 0
0.000203 0.000012 IP 192.168.10.204.51934 > 192.168.10.201.1234: Flags [P.], seq 1:2, ack 1, win 1027, length 1
0.000279 0.000076 IP 192.168.10.201.1234 > 192.168.10.204.51934: Flags [.], ack 2, win 229, length 0
0.000778 0.000499 IP 192.168.10.201.1234 > 192.168.10.204.51934: Flags [P.], seq 1:2, ack 2, win 229, length 1
0.042327 0.041549 IP 192.168.10.204.51934 > 192.168.10.201.1234: Flags [.], ack 2, win 1027, length 0
0.532116 0.489789 IP 192.168.10.204.51934 > 192.168.10.201.1234: Flags [P.], seq 2:3, ack 2, win 1027, length 1
0.532310 0.000194 IP 192.168.10.201.1234 > 192.168.10.204.51934: Flags [P.], seq 2:3, ack 3, win 229, length 1
0.574325 0.042015 IP 192.168.10.204.51934 > 192.168.10.201.1234: Flags [.], ack 3, win 1027, length 0
1.050133 0.475808 IP 192.168.10.204.51934 > 192.168.10.201.1234: Flags [P.], seq 3:4, ack 3, win 1027, length 1
1.050326 0.000193 IP 192.168.10.201.1234 > 192.168.10.204.51934: Flags [P.], seq 3:4, ack 4, win 229, length 1
1.092328 0.042002 IP 192.168.10.204.51934 > 192.168.10.201.1234: Flags [.], ack 4, win 1027, length 0
1.553995 0.461667 IP 192.168.10.204.51934 > 192.168.10.201.1234: Flags [P.], seq 4:5, ack 4, win 1027, length 1
1.554159 0.000164 IP 192.168.10.201.1234 > 192.168.10.204.51934: Flags [P.], seq 4:5, ack 5, win 229, length 1
1.596327 0.042168 IP 192.168.10.204.51934 > 192.168.10.201.1234: Flags [.], ack 5, win 1027, length 0
2.086246 0.489919 IP 192.168.10.204.51934 > 192.168.10.201.1234: Flags [P.], seq 5:6, ack 5, win 1027, length 1
2.086429 0.000183 IP 192.168.10.201.1234 > 192.168.10.204.51934: Flags [P.], seq 5:6, ack 6, win 229, length 1
2.128326 0.041897 IP 192.168.10.204.51934 > 192.168.10.201.1234: Flags [.], ack 6, win 1027, length 0
2.618501 0.490175 IP 192.168.10.204.51934 > 192.168.10.201.1234: Flags [P.], seq 6:7, ack 6, win 1027, length 1
2.618661 0.000160 IP 192.168.10.201.1234 > 192.168.10.204.51934: Flags [P.], seq 6:7, ack 7, win 229, length 1
2.660327 0.041666 IP 192.168.10.204.51934 > 192.168.10.201.1234: Flags [.], ack 7, win 1027, length 0
3.129861 0.469534 IP 192.168.10.204.51934 > 192.168.10.201.1234: Flags [P.], seq 7:8, ack 7, win 1027, length 1
3.130044 0.000183 IP 192.168.10.201.1234 > 192.168.10.204.51934: Flags [P.], seq 7:8, ack 8, win 229, length 1
3.170076 0.040032 IP 192.168.10.204.51934 > 192.168.10.201.1234: Flags [.], ack 8, win 1027, length 0
3.636358 0.466282 IP 192.168.10.204.51934 > 192.168.10.201.1234: Flags [P.], seq 8:9, ack 8, win 1027, length 1
3.636541 0.000183 IP 192.168.10.201.1234 > 192.168.10.204.51934: Flags [P.], seq 8:9, ack 9, win 229, length 1
3.678326 0.041785 IP 192.168.10.204.51934 > 192.168.10.201.1234: Flags [.], ack 9, win 1027, length 0
4.168610 0.490284 IP 192.168.10.204.51934 > 192.168.10.201.1234: Flags [P.], seq 9:10, ack 9, win 1027, length 1
4.168794 0.000184 IP 192.168.10.201.1234 > 192.168.10.204.51934: Flags [P.], seq 9:10, ack 10, win 229, length 1
4.210325 0.041531 IP 192.168.10.204.51934 > 192.168.10.201.1234: Flags [.], ack 10, win 1027, length 0
4.701098 0.490773 IP 192.168.10.204.51934 > 192.168.10.201.1234: Flags [P.], seq 10:11, ack 10, win 1027, length 1
4.701306 0.000208 IP 192.168.10.201.1234 > 192.168.10.204.51934: Flags [P.], seq 10:11, ack 11, win 229, length 1
4.743325 0.042019 IP 192.168.10.204.51934 > 192.168.10.201.1234: Flags [.], ack 11, win 1027, length 0
5.229861 0.486536 IP 192.168.10.204.51934 > 192.168.10.201.1234: Flags [P.], seq 11:12, ack 11, win 1027, length 1
5.230046 0.000185 IP 192.168.10.201.1234 > 192.168.10.204.51934: Flags [P.], seq 11:12, ack 12, win 229, length 1
5.272326 0.042280 IP 192.168.10.204.51934 > 192.168.10.201.1234: Flags [.], ack 12, win 1027, length 0
5.734250 0.461924 IP 192.168.10.204.51934 > 192.168.10.201.1234: Flags [P.], seq 12:13, ack 12, win 1027, length 1
5.734429 0.000179 IP 192.168.10.201.1234 > 192.168.10.204.51934: Flags [P.], seq 12:13, ack 13, win 229, length 1
5.776324 0.041895 IP 192.168.10.204.51934 > 192.168.10.201.1234: Flags [.], ack 13, win 1027, length 0
6.266499 0.490175 IP 192.168.10.204.51934 > 192.168.10.201.1234: Flags [P.], seq 13:14, ack 13, win 1027, length 1
6.266681 0.000182 IP 192.168.10.201.1234 > 192.168.10.204.51934: Flags [P.], seq 13:14, ack 14, win 229, length 1
6.308327 0.041646 IP 192.168.10.204.51934 > 192.168.10.201.1234: Flags [.], ack 14, win 1027, length 0
6.798758 0.490431 IP 192.168.10.204.51934 > 192.168.10.201.1234: Flags [P.], seq 14:15, ack 14, win 1027, length 1
6.798934 0.000176 IP 192.168.10.201.1234 > 192.168.10.204.51934: Flags [P.], seq 14:15, ack 15, win 229, length 1
6.841327 0.042393 IP 192.168.10.204.51934 > 192.168.10.201.1234: Flags [.], ack 15, win 1027, length 0
7.323756 0.482429 IP 192.168.10.204.51934 > 192.168.10.201.1234: Flags [P.], seq 15:16, ack 15, win 1027, length 1
7.323945 0.000189 IP 192.168.10.201.1234 > 192.168.10.204.51934: Flags [P.], seq 15:16, ack 16, win 229, length 1
7.366328 0.042383 IP 192.168.10.204.51934 > 192.168.10.201.1234: Flags [.], ack 16, win 1027, length 0
7.856227 0.489899 IP 192.168.10.204.51934 > 192.168.10.201.1234: Flags [P.], seq 16:17, ack 16, win 1027, length 1
7.856379 0.000152 IP 192.168.10.201.1234 > 192.168.10.204.51934: Flags [P.], seq 16:17, ack 17, win 229, length 1
7.898385 0.042006 IP 192.168.10.204.51934 > 192.168.10.201.1234: Flags [.], ack 17, win 1027, length 0
8.388483 0.490098 IP 192.168.10.204.51934 > 192.168.10.201.1234: Flags [P.], seq 17:18, ack 17, win 1027, length 1
8.388683 0.000200 IP 192.168.10.201.1234 > 192.168.10.204.51934: Flags [P.], seq 17:18, ack 18, win 229, length 1
8.430327 0.041644 IP 192.168.10.204.51934 > 192.168.10.201.1234: Flags [.], ack 18, win 1027, length 0
8.916356 0.486029 IP 192.168.10.204.51934 > 192.168.10.201.1234: Flags [P.], seq 18:19, ack 18, win 1027, length 1
8.916541 0.000185 IP 192.168.10.201.1234 > 192.168.10.204.51934: Flags [P.], seq 18:19, ack 19, win 229, length 1
8.958325 0.041784 IP 192.168.10.204.51934 > 192.168.10.201.1234: Flags [.], ack 19, win 1027, length 0
9.419785 0.461460 IP 192.168.10.204.51934 > 192.168.10.201.1234: Flags [P.], seq 19:20, ack 19, win 1027, length 1
9.419987 0.000202 IP 192.168.10.201.1234 > 192.168.10.204.51934: Flags [P.], seq 19:20, ack 20, win 229, length 1
9.462327 0.042340 IP 192.168.10.204.51934 > 192.168.10.201.1234: Flags [.], ack 20, win 1027, length 0
9.931104 0.468777 IP 192.168.10.204.51934 > 192.168.10.201.1234: Flags [P.], seq 20:21, ack 20, win 1027, length 1
9.931262 0.000158 IP 192.168.10.201.1234 > 192.168.10.204.51934: Flags [P.], seq 20:21, ack 21, win 229, length 1
9.973326 0.042064 IP 192.168.10.204.51934 > 192.168.10.201.1234: Flags [.], ack 21, win 1027, length 0
10.448419 0.475093 IP 192.168.10.204.51934 > 192.168.10.201.1234: Flags [P.], seq 21:22, ack 21, win 1027, length 1
10.448593 0.000174 IP 192.168.10.201.1234 > 192.168.10.204.51934: Flags [P.], seq 21:22, ack 22, win 229, length 1
10.490326 0.041733 IP 192.168.10.204.51934 > 192.168.10.201.1234: Flags [.], ack 22, win 1027, length 0
10.961665 0.471339 IP 192.168.10.204.51934 > 192.168.10.201.1234: Flags [P.], seq 22:23, ack 22, win 1027, length 1
10.961872 0.000207 IP 192.168.10.201.1234 > 192.168.10.204.51934: Flags [P.], seq 22:23, ack 23, win 229, length 1
11.004326 0.042454 IP 192.168.10.204.51934 > 192.168.10.201.1234: Flags [.], ack 23, win 1027, length 0
11.464916 0.460590 IP 192.168.10.204.51934 > 192.168.10.201.1234: Flags [P.], seq 23:24, ack 23, win 1027, length 1
11.465114 0.000198 IP 192.168.10.201.1234 > 192.168.10.204.51934: Flags [P.], seq 23:24, ack 24, win 229, length 1
11.507326 0.042212 IP 192.168.10.204.51934 > 192.168.10.201.1234: Flags [.], ack 24, win 1027, length 0
11.967121 0.459795 IP 192.168.10.204.51934 > 192.168.10.201.1234: Flags [P.], seq 24:25, ack 24, win 1027, length 1
11.967328 0.000207 IP 192.168.10.201.1234 > 192.168.10.204.51934: Flags [P.], seq 24:25, ack 25, win 229, length 1
12.009325 0.041997 IP 192.168.10.204.51934 > 192.168.10.201.1234: Flags [.], ack 25, win 1027, length 0
12.489888 0.480563 IP 192.168.10.204.51934 > 192.168.10.201.1234: Flags [P.], seq 25:26, ack 25, win 1027, length 1
12.490074 0.000186 IP 192.168.10.201.1234 > 192.168.10.204.51934: Flags [P.], seq 25:26, ack 26, win 229, length 1
12.532323 0.042249 IP 192.168.10.204.51934 > 192.168.10.201.1234: Flags [.], ack 26, win 1027, length 0
12.991423 0.459100 IP 192.168.10.204.51934 > 192.168.10.201.1234: Flags [P.], seq 26:27, ack 26, win 1027, length 1
12.991616 0.000193 IP 192.168.10.201.1234 > 192.168.10.204.51934: Flags [P.], seq 26:27, ack 27, win 229, length 1
13.033326 0.041710 IP 192.168.10.204.51934 > 192.168.10.201.1234: Flags [.], ack 27, win 1027, length 0
13.505361 0.472035 IP 192.168.10.204.51934 > 192.168.10.201.1234: Flags [P.], seq 27:28, ack 27, win 1027, length 1
13.505550 0.000189 IP 192.168.10.201.1234 > 192.168.10.204.51934: Flags [P.], seq 27:28, ack 28, win 229, length 1
13.547324 0.041774 IP 192.168.10.204.51934 > 192.168.10.201.1234: Flags [.], ack 28, win 1027, length 0
14.013134 0.465810 IP 192.168.10.204.51934 > 192.168.10.201.1234: Flags [P.], seq 28:29, ack 28, win 1027, length 1
14.013356 0.000222 IP 192.168.10.201.1234 > 192.168.10.204.51934: Flags [P.], seq 28:29, ack 29, win 229, length 1
14.055325 0.041969 IP 192.168.10.204.51934 > 192.168.10.201.1234: Flags [.], ack 29, win 1027, length 0
14.526233 0.470908 IP 192.168.10.204.51934 > 192.168.10.201.1234: Flags [P.], seq 29:30, ack 29, win 1027, length 1
14.526422 0.000189 IP 192.168.10.201.1234 > 192.168.10.204.51934: Flags [P.], seq 29:30, ack 30, win 229, length 1
14.568327 0.041905 IP 192.168.10.204.51934 > 192.168.10.201.1234: Flags [.], ack 30, win 1027, length 0
15.029791 0.461464 IP 192.168.10.204.51934 > 192.168.10.201.1234: Flags [P.], seq 30:31, ack 30, win 1027, length 1
15.029962 0.000171 IP 192.168.10.201.1234 > 192.168.10.204.51934: Flags [P.], seq 30:31, ack 31, win 229, length 1
15.072324 0.042362 IP 192.168.10.204.51934 > 192.168.10.201.1234: Flags [.], ack 31, win 1027, length 0
15.535108 0.462784 IP 192.168.10.204.51934 > 192.168.10.201.1234: Flags [P.], seq 31:32, ack 31, win 1027, length 1
15.535307 0.000199 IP 192.168.10.201.1234 > 192.168.10.204.51934: Flags [P.], seq 31:32, ack 32, win 229, length 1
15.577328 0.042021 IP 192.168.10.204.51934 > 192.168.10.201.1234: Flags [.], ack 32, win 1027, length 0
16.046737 0.469409 IP 192.168.10.204.51934 > 192.168.10.201.1234: Flags [P.], seq 32:33, ack 32, win 1027, length 1
16.046926 0.000189 IP 192.168.10.201.1234 > 192.168.10.204.51934: Flags [P.], seq 32:33, ack 33, win 229, length 1
16.089385 0.042459 IP 192.168.10.204.51934 > 192.168.10.201.1234: Flags [.], ack 33, win 1027, length 0
16.555103 0.465718 IP 192.168.10.204.51934 > 192.168.10.201.1234: Flags [P.], seq 33:34, ack 33, win 1027, length 1
16.555324 0.000221 IP 192.168.10.201.1234 > 192.168.10.204.51934: Flags [P.], seq 33:34, ack 34, win 229, length 1
16.595078 0.039754 IP 192.168.10.204.51934 > 192.168.10.201.1234: Flags [.], ack 34, win 1027, length 0
17.087348 0.492270 IP 192.168.10.204.51934 > 192.168.10.201.1234: Flags [P.], seq 34:35, ack 34, win 1027, length 1
17.087502 0.000154 IP 192.168.10.201.1234 > 192.168.10.204.51934: Flags [P.], seq 34:35, ack 35, win 229, length 1
17.129325 0.041823 IP 192.168.10.204.51934 > 192.168.10.201.1234: Flags [.], ack 35, win 1027, length 0
17.613868 0.484543 IP 192.168.10.204.51934 > 192.168.10.201.1234: Flags [P.], seq 35:36, ack 35, win 1027, length 1
17.614077 0.000209 IP 192.168.10.201.1234 > 192.168.10.204.51934: Flags [P.], seq 35:36, ack 36, win 229, length 1
17.655074 0.040997 IP 192.168.10.204.51934 > 192.168.10.201.1234: Flags [.], ack 36, win 1027, length 0
18.117906 0.462832 IP 192.168.10.204.51934 > 192.168.10.201.1234: Flags [P.], seq 36:37, ack 36, win 1027, length 1
18.118145 0.000239 IP 192.168.10.201.1234 > 192.168.10.204.51934: Flags [P.], seq 36:37, ack 37, win 229, length 1
18.160325 0.042180 IP 192.168.10.204.51934 > 192.168.10.201.1234: Flags [.], ack 37, win 1027, length 0
18.618986 0.458661 IP 192.168.10.204.51934 > 192.168.10.201.1234: Flags [P.], seq 37:38, ack 37, win 1027, length 1
18.619135 0.000149 IP 192.168.10.201.1234 > 192.168.10.204.51934: Flags [P.], seq 37:38, ack 38, win 229, length 1
18.661323 0.042188 IP 192.168.10.204.51934 > 192.168.10.201.1234: Flags [.], ack 38, win 1027, length 0
19.127610 0.466287 IP 192.168.10.204.51934 > 192.168.10.201.1234: Flags [P.], seq 38:39, ack 38, win 1027, length 1
19.127788 0.000178 IP 192.168.10.201.1234 > 192.168.10.204.51934: Flags [P.], seq 38:39, ack 39, win 229, length 1
19.169325 0.041537 IP 192.168.10.204.51934 > 192.168.10.201.1234: Flags [.], ack 39, win 1027, length 0
19.641342 0.472017 IP 192.168.10.204.51934 > 192.168.10.201.1234: Flags [P.], seq 39:40, ack 39, win 1027, length 1
19.641516 0.000174 IP 192.168.10.201.1234 > 192.168.10.204.51934: Flags [P.], seq 39:40, ack 40, win 229, length 1
19.683326 0.041810 IP 192.168.10.204.51934 > 192.168.10.201.1234: Flags [.], ack 40, win 1027, length 0
20.158493 0.475167 IP 192.168.10.204.51934 > 192.168.10.201.1234: Flags [P.], seq 40:41, ack 40, win 1027, length 1
20.158678 0.000185 IP 192.168.10.201.1234 > 192.168.10.204.51934: Flags [P.], seq 40:41, ack 41, win 229, length 1
20.200326 0.041648 IP 192.168.10.204.51934 > 192.168.10.201.1234: Flags [.], ack 41, win 1027, length 0
20.665473 0.465147 IP 192.168.10.204.51934 > 192.168.10.201.1234: Flags [P.], seq 41:42, ack 41, win 1027, length 1
20.665676 0.000203 IP 192.168.10.201.1234 > 192.168.10.204.51934: Flags [P.], seq 41:42, ack 42, win 229, length 1
20.707325 0.041649 IP 192.168.10.204.51934 > 192.168.10.201.1234: Flags [.], ack 42, win 1027, length 0
21.171220 0.463895 IP 192.168.10.204.51934 > 192.168.10.201.1234: Flags [P.], seq 42:43, ack 42, win 1027, length 1
21.171410 0.000190 IP 192.168.10.201.1234 > 192.168.10.204.51934: Flags [P.], seq 42:43, ack 43, win 229, length 1
21.213324 0.041914 IP 192.168.10.204.51934 > 192.168.10.201.1234: Flags [.], ack 43, win 1027, length 0
21.676110 0.462786 IP 192.168.10.204.51934 > 192.168.10.201.1234: Flags [P.], seq 43:44, ack 43, win 1027, length 1
21.676299 0.000189 IP 192.168.10.201.1234 > 192.168.10.204.51934: Flags [P.], seq 43:44, ack 44, win 229, length 1
21.718327 0.042028 IP 192.168.10.204.51934 > 192.168.10.201.1234: Flags [.], ack 44, win 1027, length 0
22.203108 0.484781 IP 192.168.10.204.51934 > 192.168.10.201.1234: Flags [P.], seq 44:45, ack 44, win 1027, length 1
22.203259 0.000151 IP 192.168.10.201.1234 > 192.168.10.204.51934: Flags [P.], seq 44:45, ack 45, win 229, length 1
22.245331 0.042072 IP 192.168.10.204.51934 > 192.168.10.201.1234: Flags [.], ack 45, win 1027, length 0
22.722357 0.477026 IP 192.168.10.204.51934 > 192.168.10.201.1234: Flags [P.], seq 45:46, ack 45, win 1027, length 1
22.722528 0.000171 IP 192.168.10.201.1234 > 192.168.10.204.51934: Flags [P.], seq 45:46, ack 46, win 229, length 1
22.764331 0.041803 IP 192.168.10.204.51934 > 192.168.10.201.1234: Flags [.], ack 46, win 1027, length 0
23.254604 0.490273 IP 192.168.10.204.51934 > 192.168.10.201.1234: Flags [P.], seq 46:47, ack 46, win 1027, length 1
23.254781 0.000177 IP 192.168.10.201.1234 > 192.168.10.204.51934: Flags [P.], seq 46:47, ack 47, win 229, length 1
23.296326 0.041545 IP 192.168.10.204.51934 > 192.168.10.201.1234: Flags [.], ack 47, win 1027, length 0
23.784110 0.487784 IP 192.168.10.204.51934 > 192.168.10.201.1234: Flags [P.], seq 47:48, ack 47, win 1027, length 1
23.784279 0.000169 IP 192.168.10.201.1234 > 192.168.10.204.51934: Flags [P.], seq 47:48, ack 48, win 229, length 1
23.826323 0.042044 IP 192.168.10.204.51934 > 192.168.10.201.1234: Flags [.], ack 48, win 1027, length 0
24.285132 0.458809 IP 192.168.10.204.51934 > 192.168.10.201.1234: Flags [P.], seq 48:49, ack 48, win 1027, length 1
24.285336 0.000204 IP 192.168.10.201.1234 > 192.168.10.204.51934: Flags [P.], seq 48:49, ack 49, win 229, length 1
24.327327 0.041991 IP 192.168.10.204.51934 > 192.168.10.201.1234: Flags [.], ack 49, win 1027, length 0
24.794337 0.467010 IP 192.168.10.204.51934 > 192.168.10.201.1234: Flags [P.], seq 49:50, ack 49, win 1027, length 1
24.794522 0.000185 IP 192.168.10.201.1234 > 192.168.10.204.51934: Flags [P.], seq 49:50, ack 50, win 229, length 1
24.836326 0.041804 IP 192.168.10.204.51934 > 192.168.10.201.1234: Flags [.], ack 50, win 1027, length 0
25.295398 0.459072 IP 192.168.10.204.51934 > 192.168.10.201.1234: Flags [P.], seq 50:51, ack 50, win 1027, length 1
25.295548 0.000150 IP 192.168.10.201.1234 > 192.168.10.204.51934: Flags [P.], seq 50:51, ack 51, win 229, length 1
25.337326 0.041778 IP 192.168.10.204.51934 > 192.168.10.201.1234: Flags [.], ack 51, win 1027, length 0
25.807122 0.469796 IP 192.168.10.204.51934 > 192.168.10.201.1234: Flags [F.], seq 51, ack 51, win 1027, length 0
25.807462 0.000340 IP 192.168.10.201.1234 > 192.168.10.204.51934: Flags [F.], seq 51, ack 52, win 229, length 0
25.807477 0.000015 IP 192.168.10.204.51934 > 192.168.10.201.1234: Flags [.], ack 52, win 1026, length 0
