0.000000 0.000000 IP 192.168.10.200.47134 > 192.168.10.201.1234: Flags [S], seq 4246028135, win 64240, options [mss 1460,sackOK,TS val 3014788405 ecr 0,nop,wscale 7], length 0
0.000333 0.000333 IP 192.168.10.201.1234 > 192.168.10.200.47134: Flags [S.], seq 3829857342, ack 4246028136, win 28960, options [mss 1460,sackOK,TS val 1083232858 ecr 3014788405,nop,wscale 7], length 0
0.000361 0.000028 IP 192.168.10.200.47134 > 192.168.10.201.1234: Flags [.], ack 1, win 502, options [nop,nop,TS val 3014788405 ecr 1083232858], length 0
0.001599 0.000021 IP 192.168.10.200.47134 > 192.168.10.201.1234: Flags [.], ack 1025, win 501, options [nop,nop,TS val 3014788407 ecr 1083232860], length 0
0.101637 0.000022 IP 192.168.10.200.47134 > 192.168.10.201.1234: Flags [.], ack 2049, win 501, options [nop,nop,TS val 3014788507 ecr 1083232960], length 0
0.201630 0.000021 IP 192.168.10.200.47134 > 192.168.10.201.1234: Flags [.], ack 3073, win 501, options [nop,nop,TS val 3014788607 ecr 1083233060], length 0
0.301667 0.000021 IP 192.168.10.200.47134 > 192.168.10.201.1234: Flags [.], ack 4097, win 501, options [nop,nop,TS val 3014788707 ecr 1083233160], length 0
0.401651 0.000021 IP 192.168.10.200.47134 > 192.168.10.201.1234: Flags [.], ack 5121, win 501, options [nop,nop,TS val 3014788807 ecr 1083233260], length 0
0.501693 0.000021 IP 192.168.10.200.47134 > 192.168.10.201.1234: Flags [.], ack 6145, win 501, options [nop,nop,TS val 3014788907 ecr 1083233360], length 0
0.601680 0.000022 IP 192.168.10.200.47134 > 192.168.10.201.1234: Flags [.], ack 7169, win 501, options [nop,nop,TS val 3014789007 ecr 1083233460], length 0
0.701716 0.000021 IP 192.168.10.200.47134 > 192.168.10.201.1234: Flags [.], ack 8193, win 501, options [nop,nop,TS val 3014789107 ecr 1083233560], length 0
0.801706 0.000021 IP 192.168.10.200.47134 > 192.168.10.201.1234: Flags [.], ack 9217, win 501, options [nop,nop,TS val 3014789207 ecr 1083233660], length 0
0.901744 0.000020 IP 192.168.10.200.47134 > 192.168.10.201.1234: Flags [.], ack 10241, win 501, options [nop,nop,TS val 3014789307 ecr 1083233760], length 0
1.001732 0.000022 IP 192.168.10.200.47134 > 192.168.10.201.1234: Flags [.], ack 11265, win 501, options [nop,nop,TS val 3014789407 ecr 1083233860], length 0
1.101771 0.000023 IP 192.168.10.200.47134 > 192.168.10.201.1234: Flags [.], ack 12289, win 501, options [nop,nop,TS val 3014789507 ecr 1083233960], length 0
1.201757 0.000021 IP 192.168.10.200.47134 > 192.168.10.201.1234: Flags [.], ack 13313, win 501, options [nop,nop,TS val 3014789607 ecr 1083234060], length 0
1.301798 0.000021 IP 192.168.10.200.47134 > 192.168.10.201.1234: Flags [.], ack 14337, win 501, options [nop,nop,TS val 3014789707 ecr 1083234160], length 0
1.401792 0.000021 IP 192.168.10.200.47134 > 192.168.10.201.1234: Flags [.], ack 15361, win 501, options [nop,nop,TS val 3014789807 ecr 1083234260], length 0
1.501824 0.000021 IP 192.168.10.200.47134 > 192.168.10.201.1234: Flags [.], ack 16385, win 501, options [nop,nop,TS val 3014789907 ecr 1083234360], length 0
1.642092 0.040304 IP 192.168.10.200.47134 > 192.168.10.201.1234: Flags [.], ack 17409, win 501, options [nop,nop,TS val 3014790047 ecr 1083234460], length 0
1.742063 0.040238 IP 192.168.10.200.47134 > 192.168.10.201.1234: Flags [.], ack 18433, win 501, options [nop,nop,TS val 3014790147 ecr 1083234560], length 0
1.842094 0.040271 IP 192.168.10.200.47134 > 192.168.10.201.1234: Flags [.], ack 19457, win 501, options [nop,nop,TS val 3014790247 ecr 1083234660], length 0
1.942092 0.040237 IP 192.168.10.200.47134 > 192.168.10.201.1234: Flags [.], ack 20481, win 501, options [nop,nop,TS val 3014790347 ecr 1083234760], length 0
2.042093 0.040204 IP 192.168.10.200.47134 > 192.168.10.201.1234: Flags [.], ack 21505, win 501, options [nop,nop,TS val 3014790447 ecr 1083234860], length 0
2.142099 0.040218 IP 192.168.10.200.47134 > 192.168.10.201.1234: Flags [.], ack 22529, win 501, options [nop,nop,TS val 3014790547 ecr 1083234960], length 0
2.242075 0.040155 IP 192.168.10.200.47134 > 192.168.10.201.1234: Flags [.], ack 23553, win 501, options [nop,nop,TS val 3014790647 ecr 1083235060], length 0
2.346093 0.044097 IP 192.168.10.200.47134 > 192.168.10.201.1234: Flags [.], ack 24577, win 501, options [nop,nop,TS val 3014790751 ecr 1083235160], length 0
2.446096 0.044012 IP 192.168.10.200.47134 > 192.168.10.201.1234: Flags [.], ack 25601, win 501, options [nop,nop,TS val 3014790851 ecr 1083235260], length 0
2.546101 0.044005 IP 192.168.10.200.47134 > 192.168.10.201.1234: Flags [.], ack 26625, win 501, options [nop,nop,TS val 3014790951 ecr 1083235360], length 0
2.646093 0.044070 IP 192.168.10.200.47134 > 192.168.10.201.1234: Flags [.], ack 27649, win 501, options [nop,nop,TS val 3014791051 ecr 1083235460], length 0
2.746079 0.044058 IP 192.168.10.200.47134 > 192.168.10.201.1234: Flags [.], ack 28673, win 501, options [nop,nop,TS val 3014791151 ecr 1083235560], length 0
2.846094 0.043999 IP 192.168.10.200.47134 > 192.168.10.201.1234: Flags [.], ack 29697, win 501, options [nop,nop,TS val 3014791251 ecr 1083235660], length 0
2.946084 0.043988 IP 192.168.10.200.47134 > 192.168.10.201.1234: Flags [.], ack 30721, win 501, options [nop,nop,TS val 3014791351 ecr 1083235760], length 0
3.046161 0.044059 IP 192.168.10.200.47134 > 192.168.10.201.1234: Flags [.], ack 31745, win 501, options [nop,nop,TS val 3014791451 ecr 1083235860], length 0
3.146096 0.043993 IP 192.168.10.200.47134 > 192.168.10.201.1234: Flags [.], ack 32769, win 501, options [nop,nop,TS val 3014791551 ecr 1083235960], length 0
3.246095 0.044017 IP 192.168.10.200.47134 > 192.168.10.201.1234: Flags [.], ack 33793, win 501, options [nop,nop,TS val 3014791651 ecr 1083236060], length 0
3.346097 0.043986 IP 192.168.10.200.47134 > 192.168.10.201.1234: Flags [.], ack 34817, win 501, options [nop,nop,TS val 3014791751 ecr 1083236160], length 0
3.446101 0.044003 IP 192.168.10.200.47134 > 192.168.10.201.1234: Flags [.], ack 35841, win 501, options [nop,nop,TS val 3014791851 ecr 1083236260], length 0
3.546102 0.044009 IP 192.168.10.200.47134 > 192.168.10.201.1234: Flags [.], ack 36865, win 501, options [nop,nop,TS val 3014791951 ecr 1083236360], length 0
3.646092 0.043976 IP 192.168.10.200.47134 > 192.168.10.201.1234: Flags [.], ack 37889, win 501, options [nop,nop,TS val 3014792051 ecr 1083236460], length 0
3.746092 0.043999 IP 192.168.10.200.47134 > 192.168.10.201.1234: Flags [.], ack 38913, win 501, options [nop,nop,TS val 3014792151 ecr 1083236560], length 0
3.846096 0.043960 IP 192.168.10.200.47134 > 192.168.10.201.1234: Flags [.], ack 39937, win 501, options [nop,nop,TS val 3014792251 ecr 1083236660], length 0
3.946095 0.043982 IP 192.168.10.200.47134 > 192.168.10.201.1234: Flags [.], ack 40961, win 501, options [nop,nop,TS val 3014792351 ecr 1083236760], length 0
4.046039 0.043892 IP 192.168.10.200.47134 > 192.168.10.201.1234: Flags [.], ack 41985, win 501, options [nop,nop,TS val 3014792451 ecr 1083236860], length 0
4.146098 0.043954 IP 192.168.10.200.47134 > 192.168.10.201.1234: Flags [.], ack 43009, win 501, options [nop,nop,TS val 3014792551 ecr 1083236960], length 0
4.246094 0.043963 IP 192.168.10.200.47134 > 192.168.10.201.1234: Flags [.], ack 44033, win 501, options [nop,nop,TS val 3014792651 ecr 1083237060], length 0
4.346160 0.043993 IP 192.168.10.200.47134 > 192.168.10.201.1234: Flags [.], ack 45057, win 501, options [nop,nop,TS val 3014792751 ecr 1083237160], length 0
4.446094 0.043927 IP 192.168.10.200.47134 > 192.168.10.201.1234: Flags [.], ack 46081, win 501, options [nop,nop,TS val 3014792851 ecr 1083237260], length 0
4.546092 0.043896 IP 192.168.10.200.47134 > 192.168.10.201.1234: Flags [.], ack 47105, win 501, options [nop,nop,TS val 3014792951 ecr 1083237360], length 0
4.646091 0.043912 IP 192.168.10.200.47134 > 192.168.10.201.1234: Flags [.], ack 48129, win 501, options [nop,nop,TS val 3014793051 ecr 1083237460], length 0
4.746037 0.043816 IP 192.168.10.200.47134 > 192.168.10.201.1234: Flags [.], ack 49153, win 501, options [nop,nop,TS val 3014793151 ecr 1083237560], length 0
4.846077 0.043880 IP 192.168.10.200.47134 > 192.168.10.201.1234: Flags [.], ack 50177, win 501, options [nop,nop,TS val 3014793251 ecr 1083237660], length 0
4.946035 0.043840 IP 192.168.10.200.47134 > 192.168.10.201.1234: Flags [.], ack 51201, win 501, options [nop,nop,TS val 3014793351 ecr 1083237760], length 0
5.046010 0.043775 IP 192.168.10.200.47134 > 192.168.10.201.1234: Flags [.], ack 52225, win 501, options [nop,nop,TS val 3014793451 ecr 1083237860], length 0
5.146039 0.043816 IP 192.168.10.200.47134 > 192.168.10.201.1234: Flags [.], ack 53249, win 501, options [nop,nop,TS val 3014793551 ecr 1083237960], length 0
5.246036 0.043773 IP 192.168.10.200.47134 > 192.168.10.201.1234: Flags [.], ack 54273, win 501, options [nop,nop,TS val 3014793651 ecr 1083238060], length 0
5.346013 0.043763 IP 192.168.10.200.47134 > 192.168.10.201.1234: Flags [.], ack 55297, win 501, options [nop,nop,TS val 3014793751 ecr 1083238160], length 0
5.446037 0.043801 IP 192.168.10.200.47134 > 192.168.10.201.1234: Flags [.], ack 56321, win 501, options [nop,nop,TS val 3014793851 ecr 1083238260], length 0
5.546033 0.043757 IP 192.168.10.200.47134 > 192.168.10.201.1234: Flags [.], ack 57345, win 501, options [nop,nop,TS val 3014793951 ecr 1083238360], length 0
5.646043 0.043777 IP 192.168.10.200.47134 > 192.168.10.201.1234: Flags [.], ack 58369, win 501, options [nop,nop,TS val 3014794051 ecr 1083238460], length 0
5.746032 0.043731 IP 192.168.10.200.47134 > 192.168.10.201.1234: Flags [.], ack 59393, win 501, options [nop,nop,TS val 3014794151 ecr 1083238560], length 0
5.846036 0.043744 IP 192.168.10.200.47134 > 192.168.10.201.1234: Flags [.], ack 60417, win 501, options [nop,nop,TS val 3014794251 ecr 1083238660], length 0
5.946037 0.043756 IP 192.168.10.200.47134 > 192.168.10.201.1234: Flags [.], ack 61441, win 501, options [nop,nop,TS val 3014794351 ecr 1083238760], length 0
6.046036 0.043721 IP 192.168.10.200.47134 > 192.168.10.201.1234: Flags [.], ack 62465, win 501, options [nop,nop,TS val 3014794451 ecr 1083238860], length 0
6.146037 0.043732 IP 192.168.10.200.47134 > 192.168.10.201.1234: Flags [.], ack 63489, win 501, options [nop,nop,TS val 3014794551 ecr 1083238960], length 0
6.246033 0.043694 IP 192.168.10.200.47134 > 192.168.10.201.1234: Flags [.], ack 64513, win 501, options [nop,nop,TS val 3014794651 ecr 1083239060], length 0
6.346038 0.043710 IP 192.168.10.200.47134 > 192.168.10.201.1234: Flags [.], ack 65537, win 501, options [nop,nop,TS val 3014794751 ecr 1083239160], length 0
6.446035 0.043719 IP 192.168.10.200.47134 > 192.168.10.201.1234: Flags [.], ack 66561, win 501, options [nop,nop,TS val 3014794851 ecr 1083239260], length 0
6.546038 0.043675 IP 192.168.10.200.47134 > 192.168.10.201.1234: Flags [.], ack 67585, win 501, options [nop,nop,TS val 3014794951 ecr 1083239360], length 0
6.646042 0.043644 IP 192.168.10.200.47134 > 192.168.10.201.1234: Flags [.], ack 68609, win 501, options [nop,nop,TS val 3014795051 ecr 1083239461], length 0
6.746037 0.043656 IP 192.168.10.200.47134 > 192.168.10.201.1234: Flags [.], ack 69633, win 501, options [nop,nop,TS val 3014795151 ecr 1083239561], length 0
6.846037 0.043667 IP 192.168.10.200.47134 > 192.168.10.201.1234: Flags [.], ack 70657, win 501, options [nop,nop,TS val 3014795251 ecr 1083239661], length 0
6.946034 0.043624 IP 192.168.10.200.47134 > 192.168.10.201.1234: Flags [.], ack 71681, win 501, options [nop,nop,TS val 3014795351 ecr 1083239761], length 0
7.046043 0.043647 IP 192.168.10.200.47134 > 192.168.10.201.1234: Flags [.], ack 72705, win 501, options [nop,nop,TS val 3014795451 ecr 1083239861], length 0
7.146033 0.043599 IP 192.168.10.200.47134 > 192.168.10.201.1234: Flags [.], ack 73729, win 501, options [nop,nop,TS val 3014795551 ecr 1083239961], length 0
7.246035 0.043612 IP 192.168.10.200.47134 > 192.168.10.201.1234: Flags [.], ack 74753, win 501, options [nop,nop,TS val 3014795651 ecr 1083240061], length 0
7.346035 0.043573 IP 192.168.10.200.47134 > 192.168.10.201.1234: Flags [.], ack 75777, win 501, options [nop,nop,TS val 3014795751 ecr 1083240161], length 0
7.446034 0.043581 IP 192.168.10.200.47134 > 192.168.10.201.1234: Flags [.], ack 76801, win 501, options [nop,nop,TS val 3014795851 ecr 1083240261], length 0
7.546037 0.043601 IP 192.168.10.200.47134 > 192.168.10.201.1234: Flags [.], ack 77825, win 501, options [nop,nop,TS val 3014795951 ecr 1083240361], length 0
7.646018 0.043545 IP 192.168.10.200.47134 > 192.168.10.201.1234: Flags [.], ack 78849, win 501, options [nop,nop,TS val 3014796051 ecr 1083240461], length 0
7.746040 0.043576 IP 192.168.10.200.47134 > 192.168.10.201.1234: Flags [.], ack 79873, win 501, options [nop,nop,TS val 3014796151 ecr 1083240561], length 0
7.846043 0.043540 IP 192.168.10.200.47134 > 192.168.10.201.1234: Flags [.], ack 80897, win 501, options [nop,nop,TS val 3014796251 ecr 1083240661], length 0
7.946037 0.043549 IP 192.168.10.200.47134 > 192.168.10.201.1234: Flags [.], ack 81921, win 501, options [nop,nop,TS val 3014796351 ecr 1083240761], length 0
8.046036 0.043557 IP 192.168.10.200.47134 > 192.168.10.201.1234: Flags [.], ack 82945, win 501, options [nop,nop,TS val 3014796451 ecr 1083240861], length 0
8.146036 0.043519 IP 192.168.10.200.47134 > 192.168.10.201.1234: Flags [.], ack 83969, win 501, options [nop,nop,TS val 3014796551 ecr 1083240961], length 0
8.246037 0.043528 IP 192.168.10.200.47134 > 192.168.10.201.1234: Flags [.], ack 84993, win 501, options [nop,nop,TS val 3014796651 ecr 1083241061], length 0
8.346038 0.043548 IP 192.168.10.200.47134 > 192.168.10.201.1234: Flags [.], ack 86017, win 501, options [nop,nop,TS val 3014796751 ecr 1083241161], length 0
8.446030 0.043497 IP 192.168.10.200.47134 > 192.168.10.201.1234: Flags [.], ack 87041, win 501, options [nop,nop,TS val 3014796851 ecr 1083241261], length 0
8.546036 0.043516 IP 192.168.10.200.47134 > 192.168.10.201.1234: Flags [.], ack 88065, win 501, options [nop,nop,TS val 3014796951 ecr 1083241361], length 0
8.646037 0.043483 IP 192.168.10.200.47134 > 192.168.10.201.1234: Flags [.], ack 89089, win 501, options [nop,nop,TS val 3014797051 ecr 1083241461], length 0
8.746038 0.043493 IP 192.168.10.200.47134 > 192.168.10.201.1234: Flags [.], ack 90113, win 501, options [nop,nop,TS val 3014797151 ecr 1083241561], length 0
8.846038 0.043504 IP 192.168.10.200.47134 > 192.168.10.201.1234: Flags [.], ack 91137, win 501, options [nop,nop,TS val 3014797251 ecr 1083241661], length 0
8.946033 0.043453 IP 192.168.10.200.47134 > 192.168.10.201.1234: Flags [.], ack 92161, win 501, options [nop,nop,TS val 3014797351 ecr 1083241761], length 0
9.046034 0.043474 IP 192.168.10.200.47134 > 192.168.10.201.1234: Flags [.], ack 93185, win 501, options [nop,nop,TS val 3014797451 ecr 1083241861], length 0
9.146039 0.043440 IP 192.168.10.200.47134 > 192.168.10.201.1234: Flags [.], ack 94209, win 501, options [nop,nop,TS val 3014797551 ecr 1083241961], length 0
9.246037 0.043452 IP 192.168.10.200.47134 > 192.168.10.201.1234: Flags [.], ack 95233, win 501, options [nop,nop,TS val 3014797651 ecr 1083242061], length 0
9.346041 0.043467 IP 192.168.10.200.47134 > 192.168.10.201.1234: Flags [.], ack 96257, win 501, options [nop,nop,TS val 3014797751 ecr 1083242161], length 0
9.446033 0.043423 IP 192.168.10.200.47134 > 192.168.10.201.1234: Flags [.], ack 97281, win 501, options [nop,nop,TS val 3014797851 ecr 1083242261], length 0
9.546034 0.043432 IP 192.168.10.200.47134 > 192.168.10.201.1234: Flags [.], ack 98305, win 501, options [nop,nop,TS val 3014797951 ecr 1083242361], length 0
9.646037 0.043451 IP 192.168.10.200.47134 > 192.168.10.201.1234: Flags [.], ack 99329, win 501, options [nop,nop,TS val 3014798051 ecr 1083242461], length 0
9.746036 0.043408 IP 192.168.10.200.47134 > 192.168.10.201.1234: Flags [.], ack 100353, win 501, options [nop,nop,TS val 3014798151 ecr 1083242561], length 0
9.846033 0.043420 IP 192.168.10.200.47134 > 192.168.10.201.1234: Flags [.], ack 101377, win 501, options [nop,nop,TS val 3014798251 ecr 1083242661], length 0
9.946038 0.043379 IP 192.168.10.200.47134 > 192.168.10.201.1234: Flags [.], ack 102401, win 501, options [nop,nop,TS val 3014798351 ecr 1083242761], length 0
10.046035 0.043395 IP 192.168.10.200.47134 > 192.168.10.201.1234: Flags [.], ack 103425, win 501, options [nop,nop,TS val 3014798451 ecr 1083242861], length 0
10.146007 0.043379 IP 192.168.10.200.47134 > 192.168.10.201.1234: Flags [.], ack 104449, win 501, options [nop,nop,TS val 3014798551 ecr 1083242961], length 0
10.246035 0.043369 IP 192.168.10.200.47134 > 192.168.10.201.1234: Flags [.], ack 105473, win 501, options [nop,nop,TS val 3014798651 ecr 1083243061], length 0
10.346037 0.043375 IP 192.168.10.200.47134 > 192.168.10.201.1234: Flags [.], ack 106497, win 501, options [nop,nop,TS val 3014798751 ecr 1083243161], length 0
10.446034 0.043392 IP 192.168.10.200.47134 > 192.168.10.201.1234: Flags [.], ack 107521, win 501, options [nop,nop,TS val 3014798851 ecr 1083243261], length 0
10.546037 0.043355 IP 192.168.10.200.47134 > 192.168.10.201.1234: Flags [.], ack 108545, win 501, options [nop,nop,TS val 3014798951 ecr 1083243361], length 0
10.646028 0.043357 IP 192.168.10.200.47134 > 192.168.10.201.1234: Flags [.], ack 109569, win 501, options [nop,nop,TS val 3014799051 ecr 1083243461], length 0
10.746036 0.043328 IP 192.168.10.200.47134 > 192.168.10.201.1234: Flags [.], ack 110593, win 501, options [nop,nop,TS val 3014799151 ecr 1083243561], length 0
10.846039 0.043340 IP 192.168.10.200.47134 > 192.168.10.201.1234: Flags [.], ack 111617, win 501, options [nop,nop,TS val 3014799251 ecr 1083243661], length 0
10.946042 0.043359 IP 192.168.10.200.47134 > 192.168.10.201.1234: Flags [.], ack 112641, win 501, options [nop,nop,TS val 3014799351 ecr 1083243761], length 0
11.046036 0.043313 IP 192.168.10.200.47134 > 192.168.10.201.1234: Flags [.], ack 113665, win 501, options [nop,nop,TS val 3014799451 ecr 1083243861], length 0
11.146007 0.043297 IP 192.168.10.200.47134 > 192.168.10.201.1234: Flags [.], ack 114689, win 501, options [nop,nop,TS val 3014799551 ecr 1083243961], length 0
11.246037 0.043286 IP 192.168.10.200.47134 > 192.168.10.201.1234: Flags [.], ack 115713, win 501, options [nop,nop,TS val 3014799651 ecr 1083244061], length 0
11.346039 0.043302 IP 192.168.10.200.47134 > 192.168.10.201.1234: Flags [.], ack 116737, win 501, options [nop,nop,TS val 3014799751 ecr 1083244161], length 0
11.446037 0.043312 IP 192.168.10.200.47134 > 192.168.10.201.1234: Flags [.], ack 117761, win 501, options [nop,nop,TS val 3014799851 ecr 1083244261], length 0
11.546037 0.043274 IP 192.168.10.200.47134 > 192.168.10.201.1234: Flags [.], ack 118785, win 501, options [nop,nop,TS val 3014799951 ecr 1083244361], length 0
11.646034 0.043275 IP 192.168.10.200.47134 > 192.168.10.201.1234: Flags [.], ack 119809, win 501, options [nop,nop,TS val 3014800051 ecr 1083244461], length 0
11.746033 0.043292 IP 192.168.10.200.47134 > 192.168.10.201.1234: Flags [.], ack 120833, win 501, options [nop,nop,TS val 3014800151 ecr 1083244561], length 0
11.846038 0.043260 IP 192.168.10.200.47134 > 192.168.10.201.1234: Flags [.], ack 121857, win 501, options [nop,nop,TS val 3014800251 ecr 1083244661], length 0
11.946039 0.043269 IP 192.168.10.200.47134 > 192.168.10.201.1234: Flags [.], ack 122881, win 501, options [nop,nop,TS val 3014800351 ecr 1083244761], length 0
12.046038 0.043230 IP 192.168.10.200.47134 > 192.168.10.201.1234: Flags [.], ack 123905, win 501, options [nop,nop,TS val 3014800451 ecr 1083244861], length 0
12.146033 0.043238 IP 192.168.10.200.47134 > 192.168.10.201.1234: Flags [.], ack 124929, win 501, options [nop,nop,TS val 3014800551 ecr 1083244961], length 0
12.246037 0.043259 IP 192.168.10.200.47134 > 192.168.10.201.1234: Flags [.], ack 125953, win 501, options [nop,nop,TS val 3014800651 ecr 1083245061], length 0
12.346039 0.043219 IP 192.168.10.200.47134 > 192.168.10.201.1234: Flags [.], ack 126977, win 501, options [nop,nop,TS val 3014800751 ecr 1083245161], length 0
12.446042 0.043236 IP 192.168.10.200.47134 > 192.168.10.201.1234: Flags [.], ack 128001, win 501, options [nop,nop,TS val 3014800851 ecr 1083245261], length 0
12.546036 0.043193 IP 192.168.10.200.47134 > 192.168.10.201.1234: Flags [.], ack 129025, win 501, options [nop,nop,TS val 3014800951 ecr 1083245361], length 0
12.646037 0.043152 IP 192.168.10.200.47134 > 192.168.10.201.1234: Flags [.], ack 130049, win 501, options [nop,nop,TS val 3014801051 ecr 1083245461], length 0
12.746039 0.043165 IP 192.168.10.200.47134 > 192.168.10.201.1234: Flags [.], ack 131073, win 501, options [nop,nop,TS val 3014801151 ecr 1083245561], length 0
12.846041 0.043180 IP 192.168.10.200.47134 > 192.168.10.201.1234: Flags [.], ack 132097, win 501, options [nop,nop,TS val 3014801251 ecr 1083245661], length 0
12.946038 0.043143 IP 192.168.10.200.47134 > 192.168.10.201.1234: Flags [.], ack 133121, win 501, options [nop,nop,TS val 3014801351 ecr 1083245761], length 0
13.046036 0.043152 IP 192.168.10.200.47134 > 192.168.10.201.1234: Flags [.], ack 134145, win 501, options [nop,nop,TS val 3014801451 ecr 1083245861], length 0
13.146038 0.043111 IP 192.168.10.200.47134 > 192.168.10.201.1234: Flags [.], ack 135169, win 501, options [nop,nop,TS val 3014801551 ecr 1083245961], length 0
13.246039 0.043125 IP 192.168.10.200.47134 > 192.168.10.201.1234: Flags [.], ack 136193, win 501, options [nop,nop,TS val 3014801651 ecr 1083246061], length 0
13.346044 0.043092 IP 192.168.10.200.47134 > 192.168.10.201.1234: Flags [.], ack 137217, win 501, options [nop,nop,TS val 3014801751 ecr 1083246161], length 0
13.446038 0.043103 IP 192.168.10.200.47134 > 192.168.10.201.1234: Flags [.], ack 138241, win 501, options [nop,nop,TS val 3014801851 ecr 1083246261], length 0
13.546037 0.043061 IP 192.168.10.200.47134 > 192.168.10.201.1234: Flags [.], ack 139265, win 501, options [nop,nop,TS val 3014801951 ecr 1083246361], length 0
13.646093 0.043044 IP 192.168.10.200.47134 > 192.168.10.201.1234: Flags [.], ack 140289, win 501, options [nop,nop,TS val 3014802051 ecr 1083246461], length 0
13.746038 0.042988 IP 192.168.10.200.47134 > 192.168.10.201.1234: Flags [.], ack 141313, win 501, options [nop,nop,TS val 3014802151 ecr 1083246561], length 0
13.846035 0.042995 IP 192.168.10.200.47134 > 192.168.10.201.1234: Flags [.], ack 142337, win 501, options [nop,nop,TS val 3014802251 ecr 1083246661], length 0
13.946037 0.042959 IP 192.168.10.200.47134 > 192.168.10.201.1234: Flags [.], ack 143361, win 501, options [nop,nop,TS val 3014802351 ecr 1083246761], length 0
14.046038 0.042970 IP 192.168.10.200.47134 > 192.168.10.201.1234: Flags [.], ack 144385, win 501, options [nop,nop,TS val 3014802451 ecr 1083246861], length 0
14.146008 0.042902 IP 192.168.10.200.47134 > 192.168.10.201.1234: Flags [.], ack 145409, win 501, options [nop,nop,TS val 3014802551 ecr 1083246961], length 0
14.246039 0.042944 IP 192.168.10.200.47134 > 192.168.10.201.1234: Flags [.], ack 146433, win 501, options [nop,nop,TS val 3014802651 ecr 1083247061], length 0
14.346037 0.042905 IP 192.168.10.200.47134 > 192.168.10.201.1234: Flags [.], ack 147457, win 501, options [nop,nop,TS val 3014802751 ecr 1083247161], length 0
14.446035 0.042917 IP 192.168.10.200.47134 > 192.168.10.201.1234: Flags [.], ack 148481, win 501, options [nop,nop,TS val 3014802851 ecr 1083247261], length 0
14.546035 0.042925 IP 192.168.10.200.47134 > 192.168.10.201.1234: Flags [.], ack 149505, win 501, options [nop,nop,TS val 3014802951 ecr 1083247361], length 0
14.646036 0.042893 IP 192.168.10.200.47134 > 192.168.10.201.1234: Flags [.], ack 150529, win 501, options [nop,nop,TS val 3014803051 ecr 1083247461], length 0
14.746035 0.042900 IP 192.168.10.200.47134 > 192.168.10.201.1234: Flags [.], ack 151553, win 501, options [nop,nop,TS val 3014803151 ecr 1083247561], length 0
14.846038 0.042867 IP 192.168.10.200.47134 > 192.168.10.201.1234: Flags [.], ack 152577, win 501, options [nop,nop,TS val 3014803251 ecr 1083247661], length 0
14.946037 0.042878 IP 192.168.10.200.47134 > 192.168.10.201.1234: Flags [.], ack 153601, win 501, options [nop,nop,TS val 3014803351 ecr 1083247761], length 0
15.046036 0.042835 IP 192.168.10.200.47134 > 192.168.10.201.1234: Flags [.], ack 154625, win 501, options [nop,nop,TS val 3014803451 ecr 1083247861], length 0
15.146038 0.042851 IP 192.168.10.200.47134 > 192.168.10.201.1234: Flags [.], ack 155649, win 501, options [nop,nop,TS val 3014803551 ecr 1083247961], length 0
15.246036 0.042861 IP 192.168.10.200.47134 > 192.168.10.201.1234: Flags [.], ack 156673, win 501, options [nop,nop,TS val 3014803651 ecr 1083248061], length 0
15.346037 0.042822 IP 192.168.10.200.47134 > 192.168.10.201.1234: Flags [.], ack 157697, win 501, options [nop,nop,TS val 3014803751 ecr 1083248161], length 0
15.446036 0.042827 IP 192.168.10.200.47134 > 192.168.10.201.1234: Flags [.], ack 158721, win 501, options [nop,nop,TS val 3014803851 ecr 1083248261], length 0
15.546034 0.042792 IP 192.168.10.200.47134 > 192.168.10.201.1234: Flags [.], ack 159745, win 501, options [nop,nop,TS val 3014803951 ecr 1083248361], length 0
15.646039 0.042812 IP 192.168.10.200.47134 > 192.168.10.201.1234: Flags [.], ack 160769, win 501, options [nop,nop,TS val 3014804051 ecr 1083248461], length 0
15.745931 0.042660 IP 192.168.10.200.47134 > 192.168.10.201.1234: Flags [.], ack 161793, win 501, options [nop,nop,TS val 3014804151 ecr 1083248561], length 0
15.846037 0.042783 IP 192.168.10.200.47134 > 192.168.10.201.1234: Flags [.], ack 162817, win 501, options [nop,nop,TS val 3014804251 ecr 1083248661], length 0
15.946036 0.042746 IP 192.168.10.200.47134 > 192.168.10.201.1234: Flags [.], ack 163841, win 501, options [nop,nop,TS val 3014804351 ecr 1083248761], length 0
16.046035 0.042757 IP 192.168.10.200.47134 > 192.168.10.201.1234: Flags [.], ack 164865, win 501, options [nop,nop,TS val 3014804451 ecr 1083248861], length 0
16.146038 0.042721 IP 192.168.10.200.47134 > 192.168.10.201.1234: Flags [.], ack 165889, win 501, options [nop,nop,TS val 3014804551 ecr 1083248962], length 0
16.246033 0.042725 IP 192.168.10.200.47134 > 192.168.10.201.1234: Flags [.], ack 166913, win 501, options [nop,nop,TS val 3014804651 ecr 1083249062], length 0
16.346035 0.042693 IP 192.168.10.200.47134 > 192.168.10.201.1234: Flags [.], ack 167937, win 501, options [nop,nop,TS val 3014804751 ecr 1083249162], length 0
16.446035 0.042705 IP 192.168.10.200.47134 > 192.168.10.201.1234: Flags [.], ack 168961, win 501, options [nop,nop,TS val 3014804851 ecr 1083249262], length 0
16.546033 0.042713 IP 192.168.10.200.47134 > 192.168.10.201.1234: Flags [.], ack 169985, win 501, options [nop,nop,TS val 3014804951 ecr 1083249362], length 0
16.646034 0.042672 IP 192.168.10.200.47134 > 192.168.10.201.1234: Flags [.], ack 171009, win 501, options [nop,nop,TS val 3014805051 ecr 1083249462], length 0
16.746042 0.042687 IP 192.168.10.200.47134 > 192.168.10.201.1234: Flags [.], ack 172033, win 501, options [nop,nop,TS val 3014805151 ecr 1083249562], length 0
16.846038 0.042703 IP 192.168.10.200.47134 > 192.168.10.201.1234: Flags [.], ack 173057, win 501, options [nop,nop,TS val 3014805251 ecr 1083249662], length 0
16.946043 0.042663 IP 192.168.10.200.47134 > 192.168.10.201.1234: Flags [.], ack 174081, win 501, options [nop,nop,TS val 3014805351 ecr 1083249762], length 0
17.046042 0.042680 IP 192.168.10.200.47134 > 192.168.10.201.1234: Flags [.], ack 175105, win 501, options [nop,nop,TS val 3014805451 ecr 1083249862], length 0
17.146039 0.042636 IP 192.168.10.200.47134 > 192.168.10.201.1234: Flags [.], ack 176129, win 501, options [nop,nop,TS val 3014805551 ecr 1083249962], length 0
17.246039 0.042650 IP 192.168.10.200.47134 > 192.168.10.201.1234: Flags [.], ack 177153, win 501, options [nop,nop,TS val 3014805651 ecr 1083250062], length 0
17.346033 0.042607 IP 192.168.10.200.47134 > 192.168.10.201.1234: Flags [.], ack 178177, win 501, options [nop,nop,TS val 3014805751 ecr 1083250162], length 0
17.446039 0.042623 IP 192.168.10.200.47134 > 192.168.10.201.1234: Flags [.], ack 179201, win 501, options [nop,nop,TS val 3014805851 ecr 1083250262], length 0
17.546034 0.042630 IP 192.168.10.200.47134 > 192.168.10.201.1234: Flags [.], ack 180225, win 501, options [nop,nop,TS val 3014805951 ecr 1083250362], length 0
17.646036 0.042592 IP 192.168.10.200.47134 > 192.168.10.201.1234: Flags [.], ack 181249, win 501, options [nop,nop,TS val 3014806051 ecr 1083250462], length 0
17.746036 0.042604 IP 192.168.10.200.47134 > 192.168.10.201.1234: Flags [.], ack 182273, win 501, options [nop,nop,TS val 3014806151 ecr 1083250562], length 0
17.846035 0.042614 IP 192.168.10.200.47134 > 192.168.10.201.1234: Flags [.], ack 183297, win 501, options [nop,nop,TS val 3014806251 ecr 1083250662], length 0
17.946033 0.042577 IP 192.168.10.200.47134 > 192.168.10.201.1234: Flags [.], ack 184321, win 501, options [nop,nop,TS val 3014806351 ecr 1083250762], length 0
18.046037 0.042595 IP 192.168.10.200.47134 > 192.168.10.201.1234: Flags [.], ack 185345, win 501, options [nop,nop,TS val 3014806451 ecr 1083250862], length 0
18.146036 0.042556 IP 192.168.10.200.47134 > 192.168.10.201.1234: Flags [.], ack 186369, win 501, options [nop,nop,TS val 3014806551 ecr 1083250962], length 0
18.246037 0.042569 IP 192.168.10.200.47134 > 192.168.10.201.1234: Flags [.], ack 187393, win 501, options [nop,nop,TS val 3014806651 ecr 1083251062], length 0
18.346033 0.042574 IP 192.168.10.200.47134 > 192.168.10.201.1234: Flags [.], ack 188417, win 501, options [nop,nop,TS val 3014806751 ecr 1083251162], length 0
18.446038 0.042534 IP 192.168.10.200.47134 > 192.168.10.201.1234: Flags [.], ack 189441, win 501, options [nop,nop,TS val 3014806851 ecr 1083251262], length 0
18.546028 0.042542 IP 192.168.10.200.47134 > 192.168.10.201.1234: Flags [.], ack 190465, win 501, options [nop,nop,TS val 3014806951 ecr 1083251362], length 0
18.646039 0.042515 IP 192.168.10.200.47134 > 192.168.10.201.1234: Flags [.], ack 191489, win 501, options [nop,nop,TS val 3014807051 ecr 1083251462], length 0
18.746036 0.042522 IP 192.168.10.200.47134 > 192.168.10.201.1234: Flags [.], ack 192513, win 501, options [nop,nop,TS val 3014807151 ecr 1083251562], length 0
18.846037 0.042486 IP 192.168.10.200.47134 > 192.168.10.201.1234: Flags [.], ack 193537, win 501, options [nop,nop,TS val 3014807251 ecr 1083251662], length 0
18.946039 0.042500 IP 192.168.10.200.47134 > 192.168.10.201.1234: Flags [.], ack 194561, win 501, options [nop,nop,TS val 3014807351 ecr 1083251762], length 0
19.046034 0.042460 IP 192.168.10.200.47134 > 192.168.10.201.1234: Flags [.], ack 195585, win 501, options [nop,nop,TS val 3014807451 ecr 1083251862], length 0
19.146033 0.042468 IP 192.168.10.200.47134 > 192.168.10.201.1234: Flags [.], ack 196609, win 501, options [nop,nop,TS val 3014807551 ecr 1083251962], length 0
19.246034 0.042483 IP 192.168.10.200.47134 > 192.168.10.201.1234: Flags [.], ack 197633, win 501, options [nop,nop,TS val 3014807651 ecr 1083252062], length 0
19.346012 0.042420 IP 192.168.10.200.47134 > 192.168.10.201.1234: Flags [.], ack 198657, win 501, options [nop,nop,TS val 3014807751 ecr 1083252162], length 0
19.446036 0.042459 IP 192.168.10.200.47134 > 192.168.10.201.1234: Flags [.], ack 199681, win 501, options [nop,nop,TS val 3014807851 ecr 1083252262], length 0
19.546037 0.042470 IP 192.168.10.200.47134 > 192.168.10.201.1234: Flags [.], ack 200705, win 501, options [nop,nop,TS val 3014807951 ecr 1083252362], length 0
19.646039 0.042433 IP 192.168.10.200.47134 > 192.168.10.201.1234: Flags [.], ack 201729, win 501, options [nop,nop,TS val 3014808051 ecr 1083252462], length 0
19.746038 0.042443 IP 192.168.10.200.47134 > 192.168.10.201.1234: Flags [.], ack 202753, win 501, options [nop,nop,TS val 3014808151 ecr 1083252562], length 0
19.846035 0.042405 IP 192.168.10.200.47134 > 192.168.10.201.1234: Flags [.], ack 203777, win 501, options [nop,nop,TS val 3014808251 ecr 1083252662], length 0
19.946037 0.042419 IP 192.168.10.200.47134 > 192.168.10.201.1234: Flags [.], ack 204801, win 501, options [nop,nop,TS val 3014808351 ecr 1083252762], length 0
20.046039 0.042447 IP 192.168.10.200.47134 > 192.168.10.201.1234: Flags [.], ack 205825, win 501, options [nop,nop,TS val 3014808451 ecr 1083252862], length 0
20.146040 0.042387 IP 192.168.10.200.47134 > 192.168.10.201.1234: Flags [.], ack 206849, win 501, options [nop,nop,TS val 3014808551 ecr 1083252962], length 0
20.246034 0.042397 IP 192.168.10.200.47134 > 192.168.10.201.1234: Flags [.], ack 207873, win 501, options [nop,nop,TS val 3014808651 ecr 1083253062], length 0
20.346037 0.042416 IP 192.168.10.200.47134 > 192.168.10.201.1234: Flags [.], ack 208897, win 501, options [nop,nop,TS val 3014808751 ecr 1083253162], length 0
20.446035 0.042370 IP 192.168.10.200.47134 > 192.168.10.201.1234: Flags [.], ack 209921, win 501, options [nop,nop,TS val 3014808851 ecr 1083253262], length 0
20.546039 0.042390 IP 192.168.10.200.47134 > 192.168.10.201.1234: Flags [.], ack 210945, win 501, options [nop,nop,TS val 3014808951 ecr 1083253362], length 0
20.646036 0.042346 IP 192.168.10.200.47134 > 192.168.10.201.1234: Flags [.], ack 211969, win 501, options [nop,nop,TS val 3014809051 ecr 1083253462], length 0
20.746036 0.042361 IP 192.168.10.200.47134 > 192.168.10.201.1234: Flags [.], ack 212993, win 501, options [nop,nop,TS val 3014809151 ecr 1083253562], length 0
20.846038 0.042374 IP 192.168.10.200.47134 > 192.168.10.201.1234: Flags [.], ack 214017, win 501, options [nop,nop,TS val 3014809251 ecr 1083253662], length 0
20.946038 0.042337 IP 192.168.10.200.47134 > 192.168.10.201.1234: Flags [.], ack 215041, win 501, options [nop,nop,TS val 3014809351 ecr 1083253762], length 0
21.046038 0.042346 IP 192.168.10.200.47134 > 192.168.10.201.1234: Flags [.], ack 216065, win 501, options [nop,nop,TS val 3014809451 ecr 1083253862], length 0
21.146039 0.042309 IP 192.168.10.200.47134 > 192.168.10.201.1234: Flags [.], ack 217089, win 501, options [nop,nop,TS val 3014809551 ecr 1083253962], length 0
21.246038 0.042323 IP 192.168.10.200.47134 > 192.168.10.201.1234: Flags [.], ack 218113, win 501, options [nop,nop,TS val 3014809651 ecr 1083254062], length 0
21.346037 0.042330 IP 192.168.10.200.47134 > 192.168.10.201.1234: Flags [.], ack 219137, win 501, options [nop,nop,TS val 3014809751 ecr 1083254162], length 0
21.446036 0.042293 IP 192.168.10.200.47134 > 192.168.10.201.1234: Flags [.], ack 220161, win 501, options [nop,nop,TS val 3014809851 ecr 1083254262], length 0
21.546033 0.042302 IP 192.168.10.200.47134 > 192.168.10.201.1234: Flags [.], ack 221185, win 501, options [nop,nop,TS val 3014809951 ecr 1083254362], length 0
21.646042 0.042271 IP 192.168.10.200.47134 > 192.168.10.201.1234: Flags [.], ack 222209, win 501, options [nop,nop,TS val 3014810051 ecr 1083254462], length 0
21.746036 0.042277 IP 192.168.10.200.47134 > 192.168.10.201.1234: Flags [.], ack 223233, win 501, options [nop,nop,TS val 3014810151 ecr 1083254562], length 0
21.846043 0.042243 IP 192.168.10.200.47134 > 192.168.10.201.1234: Flags [.], ack 224257, win 501, options [nop,nop,TS val 3014810251 ecr 1083254662], length 0
21.946035 0.042253 IP 192.168.10.200.47134 > 192.168.10.201.1234: Flags [.], ack 225281, win 501, options [nop,nop,TS val 3014810351 ecr 1083254762], length 0
22.046042 0.042218 IP 192.168.10.200.47134 > 192.168.10.201.1234: Flags [.], ack 226305, win 501, options [nop,nop,TS val 3014810451 ecr 1083254862], length 0
22.146016 0.042206 IP 192.168.10.200.47134 > 192.168.10.201.1234: Flags [.], ack 227329, win 501, options [nop,nop,TS val 3014810551 ecr 1083254962], length 0
22.246008 0.042161 IP 192.168.10.200.47134 > 192.168.10.201.1234: Flags [.], ack 228353, win 501, options [nop,nop,TS val 3014810651 ecr 1083255062], length 0
22.346037 0.042198 IP 192.168.10.200.47134 > 192.168.10.201.1234: Flags [.], ack 229377, win 501, options [nop,nop,TS val 3014810751 ecr 1083255162], length 0
22.445998 0.042171 IP 192.168.10.200.47134 > 192.168.10.201.1234: Flags [.], ack 230401, win 501, options [nop,nop,TS val 3014810851 ecr 1083255262], length 0
22.546040 0.042174 IP 192.168.10.200.47134 > 192.168.10.201.1234: Flags [.], ack 231425, win 501, options [nop,nop,TS val 3014810951 ecr 1083255362], length 0
22.646035 0.042185 IP 192.168.10.200.47134 > 192.168.10.201.1234: Flags [.], ack 232449, win 501, options [nop,nop,TS val 3014811051 ecr 1083255462], length 0
22.746035 0.042193 IP 192.168.10.200.47134 > 192.168.10.201.1234: Flags [.], ack 233473, win 501, options [nop,nop,TS val 3014811151 ecr 1083255562], length 0
22.846039 0.042157 IP 192.168.10.200.47134 > 192.168.10.201.1234: Flags [.], ack 234497, win 501, options [nop,nop,TS val 3014811251 ecr 1083255662], length 0
22.946035 0.042169 IP 192.168.10.200.47134 > 192.168.10.201.1234: Flags [.], ack 235521, win 501, options [nop,nop,TS val 3014811351 ecr 1083255762], length 0
23.046038 0.042132 IP 192.168.10.200.47134 > 192.168.10.201.1234: Flags [.], ack 236545, win 501, options [nop,nop,TS val 3014811451 ecr 1083255862], length 0
23.146038 0.042142 IP 192.168.10.200.47134 > 192.168.10.201.1234: Flags [.], ack 237569, win 501, options [nop,nop,TS val 3014811551 ecr 1083255962], length 0
23.246043 0.042159 IP 192.168.10.200.47134 > 192.168.10.201.1234: Flags [.], ack 238593, win 501, options [nop,nop,TS val 3014811651 ecr 1083256062], length 0
23.346034 0.042117 IP 192.168.10.200.47134 > 192.168.10.201.1234: Flags [.], ack 239617, win 501, options [nop,nop,TS val 3014811751 ecr 1083256162], length 0
23.446036 0.042132 IP 192.168.10.200.47134 > 192.168.10.201.1234: Flags [.], ack 240641, win 501, options [nop,nop,TS val 3014811851 ecr 1083256262], length 0
23.546036 0.042087 IP 192.168.10.200.47134 > 192.168.10.201.1234: Flags [.], ack 241665, win 501, options [nop,nop,TS val 3014811951 ecr 1083256362], length 0
23.646039 0.042106 IP 192.168.10.200.47134 > 192.168.10.201.1234: Flags [.], ack 242689, win 501, options [nop,nop,TS val 3014812051 ecr 1083256462], length 0
23.746042 0.042121 IP 192.168.10.200.47134 > 192.168.10.201.1234: Flags [.], ack 243713, win 501, options [nop,nop,TS val 3014812151 ecr 1083256562], length 0
23.846038 0.042076 IP 192.168.10.200.47134 > 192.168.10.201.1234: Flags [.], ack 244737, win 501, options [nop,nop,TS val 3014812251 ecr 1083256662], length 0
23.946041 0.042095 IP 192.168.10.200.47134 > 192.168.10.201.1234: Flags [.], ack 245761, win 501, options [nop,nop,TS val 3014812351 ecr 1083256762], length 0
24.046036 0.042050 IP 192.168.10.200.47134 > 192.168.10.201.1234: Flags [.], ack 246785, win 501, options [nop,nop,TS val 3014812451 ecr 1083256862], length 0
24.146036 0.042062 IP 192.168.10.200.47134 > 192.168.10.201.1234: Flags [.], ack 247809, win 501, options [nop,nop,TS val 3014812551 ecr 1083256962], length 0
24.246034 0.042068 IP 192.168.10.200.47134 > 192.168.10.201.1234: Flags [.], ack 248833, win 501, options [nop,nop,TS val 3014812651 ecr 1083257062], length 0
24.346039 0.042036 IP 192.168.10.200.47134 > 192.168.10.201.1234: Flags [.], ack 249857, win 501, options [nop,nop,TS val 3014812751 ecr 1083257162], length 0
24.446039 0.042049 IP 192.168.10.200.47134 > 192.168.10.201.1234: Flags [.], ack 250881, win 501, options [nop,nop,TS val 3014812851 ecr 1083257262], length 0
24.546034 0.042003 IP 192.168.10.200.47134 > 192.168.10.201.1234: Flags [.], ack 251905, win 501, options [nop,nop,TS val 3014812951 ecr 1083257362], length 0
24.646034 0.042019 IP 192.168.10.200.47134 > 192.168.10.201.1234: Flags [.], ack 252929, win 501, options [nop,nop,TS val 3014813051 ecr 1083257462], length 0
24.746036 0.041980 IP 192.168.10.200.47134 > 192.168.10.201.1234: Flags [.], ack 253953, win 501, options [nop,nop,TS val 3014813151 ecr 1083257562], length 0
24.846032 0.041989 IP 192.168.10.200.47134 > 192.168.10.201.1234: Flags [.], ack 254977, win 501, options [nop,nop,TS val 3014813251 ecr 1083257662], length 0
